{
  "$schema": "https://json-schema.org/draft/2020-12/schema",
  "$id": "https://foundrvibe.com/playbooks/financial-model/1.1.0",
  "x-id": "financial-model",
  "x-version": "1.1.0",
  "x-title": "Financial model",
  "type": "object",
  "additionalProperties": false,
  "required": [
    "company_name",
    "business_model",
    "market_country",
    "target_region",
    "document_language",
    "research_mode",
    "pricing",
    "current_customers",
    "current_mrr",
    "starting_cash",
    "forecast_months",
    "costs",
    "hires",
    "monthly",
    "sources"
  ],
  "properties": {
    "company_name": {
      "type": "string",
      "minLength": 1,
      "description": "The company or project name.",
      "x-ask": "What is the company called?",
      "x-source": "user",
      "x-unknown": "_Unknown — not provided_"
    },
    "business_model": {
      "type": "string",
      "minLength": 1,
      "description": "What is sold and how it is charged: subscription, one-time sale, usage, or services.",
      "x-ask": "What do you sell, and how do you charge for it?",
      "x-source": "user",
      "x-unknown": "_Unknown — not provided_"
    },
    "market_country": {
      "type": "string",
      "minLength": 1,
      "description": "Country whose currency the model uses.",
      "x-ask": "Which country and currency should the model use?",
      "x-source": "user",
      "x-unknown": "_Unknown — not provided_"
    },
    "target_region": {
      "type": "string",
      "minLength": 1,
      "description": "City, province or state, metro, or whole country the revenue plan applies to. Must fit inside market_country.",
      "x-ask": "Which city, province, or region is this model for? Say the whole country when customers are national.",
      "x-source": "user",
      "x-unknown": "_Unknown — not provided_"
    },
    "document_language": {
      "type": "string",
      "minLength": 1,
      "description": "Language for the prose. Headings stay as written in template.md.",
      "x-ask": "Leave this to the agent.",
      "x-source": "derived",
      "x-unknown": "Derive this field from the context and sources. Do not leave it blank."
    },
    "research_mode": {
      "type": "string",
      "enum": ["web", "offline"],
      "description": "web when the cited pages were opened during this run. offline when they were not.",
      "x-ask": "Leave this to the agent.",
      "x-source": "derived",
      "x-unknown": "Derive this field from the context and sources. Do not leave it blank."
    },
    "pricing": {
      "type": "array",
      "minItems": 1,
      "description": "Each plan or product with its price and billing unit.",
      "x-ask": "List each plan or product with its price and how it is billed.",
      "x-source": "user_data",
      "x-unknown": "_Unknown — not provided_",
      "items": {
        "type": "object",
        "additionalProperties": false,
        "required": ["plan", "price", "unit"],
        "properties": {
          "plan": { "type": "string", "minLength": 1 },
          "price": { "type": "number", "x-format": "currency" },
          "unit": { "type": "string", "minLength": 1 }
        }
      }
    },
    "current_customers": {
      "type": "number",
      "description": "Paying customers now. Zero when pre-revenue.",
      "x-ask": "How many paying customers do you have now? Say zero if you are pre-revenue.",
      "x-source": "user_data",
      "x-format": "number",
      "x-unknown": "_Unknown — not provided_"
    },
    "current_mrr": {
      "type": "number",
      "description": "Recurring revenue per month now. Zero when pre-revenue.",
      "x-ask": "What is your recurring revenue per month now? Say zero if you are pre-revenue.",
      "x-source": "user_data",
      "x-format": "currency",
      "x-unknown": "_Unknown — not provided_"
    },
    "starting_cash": {
      "type": "number",
      "description": "Cash in the bank at the start of the model.",
      "x-ask": "How much cash does the company have now?",
      "x-source": "user_data",
      "x-format": "currency",
      "x-unknown": "_Unknown — not provided_"
    },
    "forecast_months": {
      "type": "number",
      "description": "Months the model covers. The monthly table has this many rows.",
      "x-ask": "How many months should the model cover? Twelve is common for an early company.",
      "x-source": "user_data",
      "x-format": "number",
      "x-unknown": "_Unknown — not provided_"
    },
    "costs": {
      "type": "array",
      "minItems": 1,
      "description": "Monthly costs other than hires, each fixed or variable and labeled given or assumption.",
      "x-ask": "List your monthly costs other than salaries: hosting, tools, rent, marketing. Say which are estimates.",
      "x-source": "user_data",
      "x-unknown": "_Unknown — not provided_",
      "items": {
        "type": "object",
        "additionalProperties": false,
        "required": ["item", "monthly", "kind", "label"],
        "properties": {
          "item": { "type": "string", "minLength": 1 },
          "monthly": { "type": "number", "x-format": "currency" },
          "kind": { "type": "string", "enum": ["fixed", "variable", "cost of revenue"] },
          "label": { "type": "string", "enum": ["given", "assumption"] }
        }
      }
    },
    "hires": {
      "type": "array",
      "minItems": 1,
      "description": "Planned hires and founder pay, with monthly cost and start month. One row that says none planned when there are none.",
      "x-ask": "Who will you pay in this period, including founders, at what monthly cost, and from which month? Say none planned.",
      "x-source": "user_data",
      "x-unknown": "_Unknown — not provided_",
      "items": {
        "type": "object",
        "additionalProperties": false,
        "required": ["role", "monthly_cost", "start"],
        "properties": {
          "role": { "type": "string", "minLength": 1 },
          "monthly_cost": { "type": "number", "x-format": "currency" },
          "start": { "type": "string", "minLength": 1 }
        }
      }
    },
    "benchmarks": {
      "type": "array",
      "minItems": 1,
      "maxItems": 8,
      "description": "Published benchmarks used to judge the model, each from a page opened. A benchmark is not this company's figure.",
      "x-ask": "Leave this to the agent.",
      "x-source": "research",
      "x-unknown": "Research this field and cite a source. Do not leave it blank.",
      "items": {
        "type": "object",
        "additionalProperties": false,
        "required": ["metric", "benchmark", "source"],
        "properties": {
          "metric": { "type": "string", "minLength": 1 },
          "benchmark": { "type": "string", "minLength": 1 },
          "source": { "type": "string", "minLength": 1 }
        }
      }
    },
    "drivers": {
      "type": "array",
      "minItems": 3,
      "description": "Every input the model uses, with its value, label, and formula or basis.",
      "x-ask": "Leave this to the agent.",
      "x-source": "derived",
      "x-unknown": "Derive this field from the context and sources. Do not leave it blank.",
      "items": {
        "type": "object",
        "additionalProperties": false,
        "required": ["driver", "value", "label", "basis"],
        "properties": {
          "driver": { "type": "string", "minLength": 1 },
          "value": { "type": "string", "minLength": 1 },
          "label": { "type": "string", "enum": ["given", "sourced", "derived", "assumption"] },
          "basis": { "type": "string", "minLength": 1 }
        }
      }
    },
    "monthly": {
      "type": "array",
      "minItems": 1,
      "description": "One row per month. revenue = customers × price. net = revenue − costs. cash = last month's cash + net.",
      "x-ask": "Leave this to the agent.",
      "x-source": "derived",
      "x-unknown": "Derive this field from the context and sources. Do not leave it blank.",
      "items": {
        "type": "object",
        "additionalProperties": false,
        "required": ["month", "customers", "revenue", "costs", "net", "cash"],
        "properties": {
          "month": { "type": "string", "minLength": 1 },
          "customers": { "type": "number", "x-format": "number" },
          "revenue": { "type": "number", "x-format": "currency" },
          "costs": { "type": "number", "x-format": "currency" },
          "net": { "type": "number", "x-format": "currency" },
          "cash": { "type": "number", "x-format": "currency" }
        }
      }
    },
    "cash_chart": {
      "type": "object",
      "description": "Cash at the end of each month. x matches monthly month and series matches monthly cash, in the same order.",
      "x-ask": "Leave this to the agent.",
      "x-source": "derived",
      "x-unknown": "Derive this field from the context and sources. Do not leave it blank.",
      "x-chart": "mermaid-xy",
      "x-format": "currency",
      "additionalProperties": false,
      "required": ["x", "series"],
      "properties": {
        "x": {
          "type": "array",
          "minItems": 1,
          "items": { "type": "string", "minLength": 1 }
        },
        "series": {
          "type": "array",
          "minItems": 1,
          "items": { "type": "number" }
        },
        "seriesName": { "type": "string" }
      }
    },
    "annual_summary": {
      "type": "array",
      "minItems": 5,
      "description": "Revenue, cost of revenue, gross profit, operating expenses, and net income for the model period, each the sum of the months.",
      "x-ask": "Leave this to the agent.",
      "x-source": "derived",
      "x-unknown": "Derive this field from the context and sources. Do not leave it blank.",
      "items": {
        "type": "object",
        "additionalProperties": false,
        "required": ["line", "amount"],
        "properties": {
          "line": { "type": "string", "minLength": 1 },
          "amount": { "type": "number", "x-format": "currency" }
        }
      }
    },
    "break_even": {
      "type": "string",
      "minLength": 1,
      "description": "The first month revenue covers costs, and the customer count it takes. Say when it does not happen in the model.",
      "x-ask": "Leave this to the agent.",
      "x-source": "derived",
      "x-unknown": "Derive this field from the context and sources. Do not leave it blank."
    },
    "runway": {
      "type": "string",
      "minLength": 1,
      "description": "Cash divided by average monthly net burn, with the lowest cash month. Not limited when the company is profitable.",
      "x-ask": "Leave this to the agent.",
      "x-source": "derived",
      "x-unknown": "Derive this field from the context and sources. Do not leave it blank."
    },
    "unit_economics": {
      "type": "array",
      "minItems": 3,
      "description": "Revenue per customer, gross margin, churn, lifetime value, acquisition cost, and payback, each with its formula and benchmark.",
      "x-ask": "Leave this to the agent.",
      "x-source": "derived",
      "x-unknown": "Derive this field from the context and sources. Do not leave it blank.",
      "items": {
        "type": "object",
        "additionalProperties": false,
        "required": ["metric", "value", "formula"],
        "properties": {
          "metric": { "type": "string", "minLength": 1 },
          "value": { "type": "string", "minLength": 1 },
          "formula": { "type": "string", "minLength": 1 }
        }
      }
    },
    "default_alive": {
      "type": "string",
      "enum": ["default alive", "default dead", "not enough data"],
      "description": "Whether the company reaches profitability on current costs and growth before cash runs out.",
      "x-ask": "Leave this to the agent.",
      "x-source": "derived",
      "x-unknown": "Derive this field from the context and sources. Do not leave it blank."
    },
    "default_alive_reason": {
      "type": "string",
      "minLength": 1,
      "description": "Two sentences on the growth rate and costs behind default_alive.",
      "x-ask": "Leave this to the agent.",
      "x-source": "derived",
      "x-unknown": "Derive this field from the context and sources. Do not leave it blank."
    },
    "scenarios": {
      "type": "array",
      "minItems": 3,
      "maxItems": 3,
      "description": "Pessimistic, Base, Optimistic, in that order. Each changes only the named drivers.",
      "x-ask": "Leave this to the agent.",
      "x-source": "derived",
      "x-unknown": "Derive this field from the context and sources. Do not leave it blank.",
      "items": {
        "type": "object",
        "additionalProperties": false,
        "required": ["scenario", "change", "revenue", "ending_cash", "lowest_cash"],
        "properties": {
          "scenario": { "type": "string", "enum": ["Pessimistic", "Base", "Optimistic"] },
          "change": { "type": "string", "minLength": 1 },
          "revenue": { "type": "number", "x-format": "currency" },
          "ending_cash": { "type": "number", "x-format": "currency" },
          "lowest_cash": { "type": "number", "x-format": "currency" }
        }
      }
    },
    "sensitivity": {
      "type": "array",
      "minItems": 2,
      "maxItems": 6,
      "description": "One driver changed at a time, with its effect on ending cash.",
      "x-ask": "Leave this to the agent.",
      "x-source": "derived",
      "x-unknown": "Derive this field from the context and sources. Do not leave it blank.",
      "items": {
        "type": "object",
        "additionalProperties": false,
        "required": ["driver", "change", "ending_cash"],
        "properties": {
          "driver": { "type": "string", "minLength": 1 },
          "change": { "type": "string", "minLength": 1 },
          "ending_cash": { "type": "number", "x-format": "currency" }
        }
      }
    },
    "funding_need": {
      "type": "number",
      "description": "Cash to raise to keep a safety buffer in the pessimistic case. Zero when none is needed.",
      "x-ask": "Leave this to the agent.",
      "x-source": "derived",
      "x-format": "currency",
      "x-unknown": "Derive this field from the context and sources. Do not leave it blank."
    },
    "funding_reason": {
      "type": "string",
      "minLength": 1,
      "description": "One or two sentences on how funding_need was set.",
      "x-ask": "Leave this to the agent.",
      "x-source": "derived",
      "x-unknown": "Derive this field from the context and sources. Do not leave it blank."
    },
    "reconciliation": {
      "type": "array",
      "minItems": 3,
      "description": "Checks that the model adds up, and any difference from other plans, each with the result.",
      "x-ask": "Leave this to the agent.",
      "x-source": "derived",
      "x-unknown": "Derive this field from the context and sources. Do not leave it blank.",
      "items": {
        "type": "object",
        "additionalProperties": false,
        "required": ["check", "result"],
        "properties": {
          "check": { "type": "string", "minLength": 1 },
          "result": { "type": "string", "minLength": 1 }
        }
      }
    },
    "assumptions": {
      "type": "array",
      "minItems": 1,
      "description": "Every assumed driver, with its inputs.",
      "x-ask": "Leave this to the agent.",
      "x-source": "derived",
      "x-unknown": "Derive this field from the context and sources. Do not leave it blank.",
      "items": {
        "type": "object",
        "additionalProperties": false,
        "required": ["text"],
        "properties": {
          "text": { "type": "string", "minLength": 1 }
        }
      }
    },
    "sources": {
      "type": "array",
      "description": "Pages opened for this model. Empty only when research_mode is offline.",
      "x-ask": "Leave this to the agent.",
      "x-source": "research",
      "x-unknown": "Research this field and cite a source. Do not leave it blank.",
      "items": {
        "type": "object",
        "additionalProperties": false,
        "required": ["title", "publisher", "url", "accessed"],
        "properties": {
          "title": { "type": "string", "minLength": 1 },
          "publisher": { "type": "string", "minLength": 1 },
          "url": { "type": "string", "minLength": 1 },
          "accessed": { "type": "string", "minLength": 1 }
        }
      }
    }
  },
  "allOf": [
    {
      "if": {
        "properties": { "research_mode": { "const": "web" } },
        "required": ["research_mode"]
      },
      "then": {
        "properties": {
          "sources": { "minItems": 2 },
          "benchmarks": { "minItems": 2 }
        }
      }
    }
  ]
}
